{
  "schema_version": "5.0.0",
  "workspace_id": "demo-commerce",
  "session_id": "understand-member-order",
  "created_at": "2026-07-14T11:00:00+08:00",
  "question": "회원이 상품을 주문하면 어떤 처리가 시작되고, 무엇을 확인한 뒤 주문이 완료되는가?",
  "intent": "trace",
  "requested_depth": "default",
  "audience": "newcomer",
  "selected_stream_id": "member-place-order",
  "expected_outcome": "주문 성공의 중심 흐름과 주문이 멈추는 핵심 이유를 이해한다.",
  "stop_condition": "독자가 시작 주체, 핵심 판단, 주요 상태 변화, 성공 결과, 더 깊이 확인할 경계를 설명할 수 있다.",
  "scope": {
    "in_scope": [
      "검증 회원의 주문 요청",
      "회원 및 상품 주문 가능 여부",
      "재고 확보",
      "결제 승인",
      "주문 완료"
    ],
    "out_of_scope": [
      "관리자 상품 등록",
      "판매자 정산",
      "추천 상품 생성",
      "배송 이후 처리"
    ]
  },
  "risk_assessment": {
    "level": "high",
    "triggers": [
      "payment",
      "retry-compensation"
    ],
    "requires_atlas": true,
    "reason": "기본 설명은 Focus로 제공하되 결제 실패·timeout·재고 해제의 변경이나 검토에는 Atlas가 필요하다."
  },
  "routing_decision": {
    "selected_profile": "focus",
    "automatic_escalation": false,
    "reason": "현재 목적은 이해이며 변경 승인이 아니다. Focus에서 위험 경계를 표시하고 Atlas 링크를 제공한다."
  },
  "evidence": [
    {
      "source": "examples/demo-commerce/source-snapshot.md",
      "locator": "services/order-service",
      "excerpt": "The synthetic example traces ordering, inventory, and payment behavior.",
      "tool": "agent-native-docs",
      "captured_at": "2026-07-14T11:00:00+08:00"
    }
  ],
  "language": "ko",
  "presentation": {
    "overview_title": "이 코드베이스를 이해하는 가장 빠른 길",
    "system_summary": "회원이 판매 가능한 상품을 주문하면 재고를 확보하고 결제를 승인한 뒤 주문을 완료하는 예제 시스템",
    "flow_title": "회원이 상품을 주문하는 흐름",
    "actor_label": "검증된 회원",
    "intent_label": "상품을 주문한다",
    "success_label": "결제된 주문이 생성되고 주문 번호가 반환된다",
    "step_labels": {
      "place-order.start": {
        "label": "주문 요청",
        "summary": "회원이 상품, 수량, 결제 정보를 제출한다."
      },
      "place-order.check-member": {
        "label": "주문할 수 있는 회원인가?",
        "summary": "회원 유형, 인증 상태, 정지 여부를 확인한다."
      },
      "place-order.load-product": {
        "label": "상품 정보 확인",
        "summary": "판매 상태, 판매 기간, 현재 가격을 읽는다."
      },
      "place-order.check-product": {
        "label": "현재 주문 가능한 상품인가?",
        "summary": "판매 중이고 판매 기간 안인지 판단한다."
      },
      "place-order.create-pending": {
        "label": "주문 접수",
        "summary": "상품과 가격을 고정해 주문을 접수 상태로 만든다."
      },
      "place-order.reserve-stock": {
        "label": "재고 확보",
        "summary": "요청 수량을 주문에 맞춰 원자적으로 예약한다."
      },
      "place-order.check-reservation": {
        "label": "재고가 확보됐는가?",
        "summary": "남은 수량이 주문 수량보다 충분한지 확인한다."
      },
      "place-order.mark-reserved": {
        "label": "재고 확보 완료",
        "summary": "주문에 재고 예약 정보를 기록한다."
      },
      "place-order.request-payment": {
        "label": "결제 승인 요청",
        "summary": "재고가 확보된 뒤 결제 시스템에 승인을 요청한다."
      },
      "place-order.check-payment": {
        "label": "결제가 승인됐는가?",
        "summary": "승인, 거절, 응답 없음으로 결과를 나눈다."
      },
      "place-order.mark-paid": {
        "label": "주문 결제 완료",
        "summary": "결제 승인 정보를 저장하고 주문을 완료한다."
      },
      "place-order.emit-event": {
        "label": "후속 처리 알림",
        "summary": "확인·배송 처리를 위해 주문 완료 이벤트를 보낸다."
      },
      "place-order.confirm": {
        "label": "주문 완료",
        "summary": "회원에게 주문 번호와 완료 상태를 반환한다."
      }
    },
    "stop_reason_labels": [
      "회원이 미인증·정지 상태임",
      "상품이 판매 중이 아니거나 판매 기간 밖임",
      "주문할 재고가 부족함",
      "결제가 거절되거나 응답을 확인할 수 없음"
    ],
    "atlas_label": "결제 실패·보상·상태 전이를 포함한 전체 지도 열기"
  }
}
